<?xml version="1.0" encoding="utf-8"?>
<sca:svcagent xmlns:sca="http://www.td-tech.com/ubp/platform/sca/xml"
         xmlns:xsi="http://www.w3.org/2001/XMLSchema-instance"
         xsi:schemaLocation="http://www.td-tech.com/ubp/platform/sca/xml svc_agent_4.0.xsd"
         name="svc_agent">
         <!-- tcmalloc_trigger="on" ： open tcmalloc -->
         <!-- valgrind_trigger="on" ： open valgrind -->
    <ServiceInfo svc_type="mrs_vgw_agent" code_type="cplus" user="ubp" team="MRS" tcmalloc_trigger="off" valgrind_trigger="off">
      <SvcParams>
        <Param name="dllvalue" value="ubp_mrs_vgw"/>
        <Param name="dbenable" value="True"/>
        <Param name="db_max_conn" value="5"/>
        <Param name="db_min_conn" value="3"/>
        <Param name="hikvision_sdk_connect_time" value="2000"/>
        <Param name="hikvision_sdk_log_level" value="0"/>
        <Param name="hikvision_sdk_exception_ignore_level" value="0"/>
        <Param name="huawei_sdk_play_local_ip" value=""/>
        <Param name="huawei_sdk_log_enable" value="0"/>
        <Param name="yaan_getvideo_trigger_exception_max_error_num" value="3"/>
        <Param name="rtcp_timeout" value="180"/>
        <Param name="ptz_monitor_time" value="40"/>
        <Param name="noise_suppressor_flag" value="1"/>
        <Param name="auto_gain_control_flag" value="0"/>
        <Param name="huawei_stream_encryption" value="0"/>
        <Param name="traffic_shaping_flag" value="1"/>
        <Param name="traffic_shaping_max_tasknum" value="100"/>
        <Param name="traffic_shaping_schedule_interval" value="1"/>
        <Param name="traffic_shaping_bitrate_QCIF" value="300"/>
        <Param name="traffic_shaping_bitrate_CIF" value="600"/>
        <Param name="traffic_shaping_bitrate_D1" value="1500"/>
        <Param name="traffic_shaping_bitrate_720p" value="3000"/>
        <Param name="traffic_shaping_bitrate_1080p" value="6000"/>
        <Param name="emergency_videocall_flag" value="0"/>
      </SvcParams>
      <LoadModules>
        <Module lib="ubp_svcmgr" />
        <Module lib="ubp_threadpool" />
        <Module lib="ubp_timer" />
        <Module lib="ubp_encryption" />
        <Module lib="ubp_dao" />
        <Module lib="ubp_mq" />
        <Module lib="ubp_lmproxy" />
        <Module lib="ubp_fmproxy" />
        <Module lib="ubp_meta" />
      </LoadModules>
      <LoadPB>
      </LoadPB>
      <DependSvcs>
        <Svc name="cm_agent" />
        <Svc name="mrs_node_mgr_agent" />
      </DependSvcs>
    </ServiceInfo>
</sca:svcagent>