<?xml version="1.0" encoding="utf-8"?>
<sca:svcagent xmlns:sca="http://www.td-tech.com/ubp/platform/sca/xml"
         xmlns:xsi="http://www.w3.org/2001/XMLSchema-instance"
         xsi:schemaLocation="http://www.td-tech.com/ubp/platform/sca/xml svc_agent_4.0.xsd"
         name="svc_agent">
         <!-- tcmalloc_trigger="on" ： open tcmalloc -->
         <!-- valgrind_trigger="on" ： open valgrind -->
    <ServiceInfo svc_type="dec_vgw_agent" code_type="cplus" user="ubp" team="BDC" tcmalloc_trigger="off" valgrind_trigger="off">
      <SvcParams>
        <Param name="dllvalue" value="ubp_dec_vgw"/>
        <Param name="node_id" value="99900002"/>
        <Param name="dbenable" value="True"/>
        <Param name="bcc_port" value="5063"/>
        <Param name="sdk_log" value="False"/>
        <Param name="jitter_thd" value="100"/>
        <Param name="hikvision_sdk_connect_max_timeout" value="1000"/>
        <Param name="hikvision_ds64xxhd_t_streamtype" value="1"/>
        <Param name="minpfranum" value="0"/>
        <Param name="pfradamagenum" value="1"/>
      </SvcParams>
      <LoadModules>
        <Module lib="ubp_sca" entry="CreateCfgMgr" />
        <Module lib="ubp_svcmgr" entry="CreateModule"/>
        <Module lib="ubp_error" entry="CreateModule"/>
        <Module lib="ubp_threadpool" entry="CreateModule"/>
        <Module lib="ubp_timer" entry="CreateModule"/>
        <Module lib="ubp_encryption" entry="CreateModule"/>
        <Module lib="ubp_dao" entry="CreateModule"/>
        <Module lib="ubp_mq" entry="CreateModule"/>
        <Module lib="ubp_fmproxy" entry="CreateModule"/>
        <Module lib="ubp_lmproxy" entry="CreateModule"/>
      </LoadModules>
      <LoadPB>
      </LoadPB>
      <DependSvcs>
        <Svc name="cm_agent" />
      </DependSvcs>
    </ServiceInfo>
</sca:svcagent>