<?xml version="1.0" encoding="utf-8"?>
<sca:svcagent xmlns:sca="http://www.td-tech.com/ubp/platform/sca/xml"
         xmlns:xsi="http://www.w3.org/2001/XMLSchema-instance"
         xsi:schemaLocation="http://www.td-tech.com/ubp/platform/sca/xml svc_agent_4.0.xsd"
         name="svc_agent">
         <!-- tcmalloc_trigger="on" ： open tcmalloc -->
         <!-- valgrind_trigger="on" ： open valgrind -->
    <ServiceInfo svc_type="eir_agent" code_type="cplus" user="ubp" team="UDC" tcmalloc_trigger="off" valgrind_trigger="off">
      <SvcParams>
        <Param name="dllvalue" value="udc_eir"/>
      </SvcParams>
      <LoadModules>
        <Module lib="ubp_sca" entry="CreateCfgMgr" />
        <Module lib="ubp_svcmgr" entry="CreateModule"/>
        <Module lib="ubp_error" entry="CreateModule"/>
        <Module lib="ubp_threadpool" entry="CreateModule"/>
        <Module lib="ubp_timer" entry="CreateModule"/>
        <Module lib="ubp_encryption" entry="CreateModule"/>
        <Module lib="ubp_dao" entry="CreateModule"/>
        <Module lib="ubp_mq" entry="CreateModule"/>
        <Module lib="ubp_fmproxy" entry="CreateModule"/>
        <Module lib="ubp_lmproxy" entry="CreateModule"/>
        <Module lib="ubp_lic_man_proxy" entry="CreateModule"/>
      </LoadModules>
      <LoadPB>
      </LoadPB>
      <DependSvcs>
        <Svc name="cm_agent" />
        <Svc name="lic_man_agent" />
      </DependSvcs>
    </ServiceInfo>
</sca:svcagent>